{"context_hash":"sha256:ea7792a26f405e2ae9c6f49ca93bbe6076ceac0a1fc53d83426c7d7f2d9377e4","decision_trace_hash":"sha256:6b275d17e2477b51e044b6a0e13b3040cd4e954f27caf5b87db721f31b3ce4f5","error":null,"rejections_consumed":0,"request_hash":"sha256:4e25381ab6977bc944b742983a8f3334a5b5100154a7d49f7b5d811672397ab6","result_hash":"sha256:0fd3ce1f5c3cc87b83721785683860bc2f5944676135601f8d506c3e6df54205","run_hash":"sha256:acba25512100f80b56fc3ccd14c65be55d94800cda77585c5f41a887e398f9be","sampler_manifest_hash":"sha256:ec95eb7113ffa3a658489748912216cd8b48c609d006a9c35a095f1786a0b2c5","schema":"cps.structural-sampler-result","schema_version":"1.1.0","source_decision_hash":"sha256:63569c6ec33eaa0a8aea85b597eccceffb1937aa1cf4e0e8460702f6a0f5901e","status":"success","structural_lowering_manifest_hash":"sha256:67e2922b2e408b5dd5ae85bd4ae8439d79631899698395e020be7ee679517b82","structural_program_hash":"sha256:4a6ad9acecafcb468c2ddf7bfd587c9d941cbef7460857e247254a290e9fc763","structural_program_schema_hash":"sha256:90a4bc0821c48bc538661d681ee879f24d1ea732b19bbca1a54f4e67a11ebd59","structural_rejection_evidence_schema_hash":"sha256:ed3e214ae794a6714f410fdfadad46ed12dd8de4b29d29b48fe6e0dbb76891ba","terminal_rejection_evidence_hash":null}
