{"context_hash":"sha256:ea7792a26f405e2ae9c6f49ca93bbe6076ceac0a1fc53d83426c7d7f2d9377e4","decision_trace_hash":"sha256:bebbe87185416e8f5da37f0e093dff54336ac8cf07fbd692c2aee5623d80b1c4","error":null,"rejections_consumed":0,"request_hash":"sha256:814827c7095e5e222e235422c01e955b6ba0b7f854de3efc8a889252bb7a4d94","result_hash":"sha256:ad0a0a0e1855606abd510f486cb7ab3388f58470dfad4a586ae3472c6feed563","run_hash":"sha256:acba25512100f80b56fc3ccd14c65be55d94800cda77585c5f41a887e398f9be","sampler_manifest_hash":"sha256:ec95eb7113ffa3a658489748912216cd8b48c609d006a9c35a095f1786a0b2c5","schema":"cps.structural-sampler-result","schema_version":"1.1.0","source_decision_hash":"sha256:58402a20b2182a3f479e8998b019355604219fc618ebcf701689591c6200d9a2","status":"success","structural_lowering_manifest_hash":"sha256:67e2922b2e408b5dd5ae85bd4ae8439d79631899698395e020be7ee679517b82","structural_program_hash":"sha256:4a6ad9acecafcb468c2ddf7bfd587c9d941cbef7460857e247254a290e9fc763","structural_program_schema_hash":"sha256:90a4bc0821c48bc538661d681ee879f24d1ea732b19bbca1a54f4e67a11ebd59","structural_rejection_evidence_schema_hash":"sha256:ed3e214ae794a6714f410fdfadad46ed12dd8de4b29d29b48fe6e0dbb76891ba","terminal_rejection_evidence_hash":null}
