{"context_hash":"sha256:ea7792a26f405e2ae9c6f49ca93bbe6076ceac0a1fc53d83426c7d7f2d9377e4","decision_trace_hash":"sha256:343a43104785f946aaedbe04ae18b4f652f7e174a1f4165b7597a68ad8879575","error":null,"rejections_consumed":0,"request_hash":"sha256:5f36b3ef6f79eff4614bc630312d0c4efa408ac611b5a8a061c990ae63e00469","result_hash":"sha256:440f0108f55f435a1b3b5ccf2836b47505b1ff8ddf85f4e813f3f631471fdc63","run_hash":"sha256:acba25512100f80b56fc3ccd14c65be55d94800cda77585c5f41a887e398f9be","sampler_manifest_hash":"sha256:ec95eb7113ffa3a658489748912216cd8b48c609d006a9c35a095f1786a0b2c5","schema":"cps.structural-sampler-result","schema_version":"1.1.0","source_decision_hash":"sha256:c29f12677d502cbc4d63340198b2f1140146427f20c9468ef0cf2c64dd9f12e8","status":"success","structural_lowering_manifest_hash":"sha256:67e2922b2e408b5dd5ae85bd4ae8439d79631899698395e020be7ee679517b82","structural_program_hash":"sha256:4a6ad9acecafcb468c2ddf7bfd587c9d941cbef7460857e247254a290e9fc763","structural_program_schema_hash":"sha256:90a4bc0821c48bc538661d681ee879f24d1ea732b19bbca1a54f4e67a11ebd59","structural_rejection_evidence_schema_hash":"sha256:ed3e214ae794a6714f410fdfadad46ed12dd8de4b29d29b48fe6e0dbb76891ba","terminal_rejection_evidence_hash":null}
